{
  "id": "0f113fd0-6a2c-43d1-8253-1d7e9242a270",
  "startAt": "2026-08-08T10:00:00Z",
  "endAt": null,
  "severity": "WARNING",
  "status": "OPEN",
  "classification": "DNS_FAILURE",
  "confidence": 0.75,
  "eventIds": ["9dd2b71e-7f67-4c2c-b20d-5b776f41f270"],
  "probableCause": "Repeated DNS resolution failures were recorded.",
  "recommendations": ["Refresh the domain rule after checking direct-network DNS."]
}
